{"decision":{"criteria":[{"id":"stage1_skus","observed":1311,"pass":true,"text":"SKUs qualifying on price variation (Stage 1)","threshold":30},{"id":"stage2_within_week_share","observed":0.5384272380371605,"pass":false,"text":"Share of within-SKU log-price variance that is within a single SKU-week (must be at most this)","threshold":0.25},{"id":"stage2_qty_price_corr","observed":0.6128881971278544,"pass":false,"text":"Median |Spearman(quantity, price)| inside multi-price SKU-weeks (must be at most this)","threshold":0.2}],"estimable":false,"rule":"Stage 1: at least 30 SKUs with >= 26 selling weeks, <= 90% of weeks at the modal weekly price and >= 3 price regimes. Stage 2 (added after Stage 1 was computed, disclosed): within-SKU-week share of log-price variance <= 25% and |median Spearman(quantity, price) within multi-price SKU-weeks| <= 0.2. Both stages must pass.","text":"Price elasticity is NOT estimated. Unit prices vary a lot, but mostly between buyers and by order size inside the same week, not over time. A regression of units on price would measure the quantity-discount schedule, not how demand responds to price."},"estimates":null,"evidence":{"distribution":{"distinct_prices_quantiles":[2.0,3.0,4.0,5.0,7.0],"price_cv_quantiles":[0.1042866763981445,0.24564066975863155,0.32439678284182305,0.37532586977184784,0.5027038437841473],"quantile_levels":[0.1,0.25,0.5,0.75,0.9]},"price_rows":191590,"price_tiers_note":"46% of SKU-weeks (qualifying SKUs) show more than one unit price; 54% of log-price variance sits inside a single SKU-week; in the 23,090 multi-price SKU-weeks with at least 5 lines the median Spearman correlation between line quantity and unit price is -0.61, and 87% of them are below -0.2. That is the signature of quantity-discount tiers.","skus_considered":2753,"skus_qualifying":1311,"stage2":{"median_qty_price_spearman":-0.6128881971278544,"share_corr_below_minus_0_2":0.865569510610654,"sku_weeks":89190,"sku_weeks_multi_price_share":0.46208095077923533,"sku_weeks_tested":23090,"within_week_variance_share":0.5384272380371605},"table":[{"description":"Brocade Ring Purse","distinct_prices":8,"modal_price_gbp":0.21,"modal_price_share":0.4375,"price_cv":0.37543694633494207,"price_regimes":4,"sku":"17003","units":69909,"weeks_off_modal":54,"weeks_sold":96},{"description":"Assorted Colours Silk Fan","distinct_prices":7,"modal_price_gbp":0.75,"modal_price_share":0.33,"price_cv":0.31594415976707624,"price_regimes":5,"sku":"15036","units":43921,"weeks_off_modal":67,"weeks_sold":100},{"description":"Jumbo Bag Pink Polkadot","distinct_prices":4,"modal_price_gbp":1.95,"modal_price_share":0.59375,"price_cv":0.2769347483569891,"price_regimes":3,"sku":"22386","units":39335,"weeks_off_modal":39,"weeks_sold":96},{"description":"Pack Of 12 London Tissues","distinct_prices":4,"modal_price_gbp":0.29,"modal_price_share":0.7682926829268293,"price_cv":0.4101930095887448,"price_regimes":3,"sku":"22616","units":38582,"weeks_off_modal":19,"weeks_sold":82},{"description":"Girls Alphabet Iron On Patches","distinct_prices":3,"modal_price_gbp":0.43,"modal_price_share":0.4777777777777778,"price_cv":0.1924873468431196,"price_regimes":3,"sku":"84568","units":36308,"weeks_off_modal":47,"weeks_sold":90},{"description":"Antique Silver Tea Glass Etched","distinct_prices":5,"modal_price_gbp":1.25,"modal_price_share":0.8725490196078431,"price_cv":0.28665664273029035,"price_regimes":3,"sku":"84946","units":35675,"weeks_off_modal":13,"weeks_sold":102},{"description":"Pack Of 12 Suki Tissues","distinct_prices":6,"modal_price_gbp":0.29,"modal_price_share":0.717391304347826,"price_cv":0.5145188526520317,"price_regimes":4,"sku":"21982","units":31979,"weeks_off_modal":26,"weeks_sold":92},{"description":"Paper Chain Kit 50'S Christmas","distinct_prices":6,"modal_price_gbp":2.95,"modal_price_share":0.7439024390243902,"price_cv":0.3657781381086814,"price_regimes":4,"sku":"22086","units":31533,"weeks_off_modal":21,"weeks_sold":82},{"description":"Jumbo  Bag Baroque Black White","distinct_prices":5,"modal_price_gbp":1.95,"modal_price_share":0.5882352941176471,"price_cv":0.29175238962251554,"price_regimes":3,"sku":"85099C","units":30000,"weeks_off_modal":42,"weeks_sold":102},{"description":"Rotating Silver Angels T-Light Hldr","distinct_prices":6,"modal_price_gbp":2.55,"modal_price_share":0.6266666666666667,"price_cv":0.3757562467988498,"price_regimes":4,"sku":"84347","units":29049,"weeks_off_modal":28,"weeks_sold":75},{"description":"Jumbo Storage Bag Suki","distinct_prices":5,"modal_price_gbp":1.95,"modal_price_share":0.6176470588235294,"price_cv":0.30606866172040814,"price_regimes":3,"sku":"21931","units":28682,"weeks_off_modal":39,"weeks_sold":102},{"description":"Red Toadstool Led Night Light","distinct_prices":5,"modal_price_gbp":1.65,"modal_price_share":0.8811881188118812,"price_cv":0.3415458399982163,"price_regimes":3,"sku":"21731","units":28471,"weeks_off_modal":12,"weeks_sold":101},{"description":"Party Bunting","distinct_prices":5,"modal_price_gbp":4.65,"modal_price_share":0.45544554455445546,"price_cv":0.23421431361664385,"price_regimes":3,"sku":"47566","units":28085,"weeks_off_modal":55,"weeks_sold":101},{"description":"Jumbo Shopper Vintage Red Paisley","distinct_prices":4,"modal_price_gbp":1.95,"modal_price_share":0.6041666666666666,"price_cv":0.24575863296042136,"price_regimes":3,"sku":"22411","units":26970,"weeks_off_modal":38,"weeks_sold":96},{"description":"Pack Of 12 Red Retrospot Tissues","distinct_prices":5,"modal_price_gbp":0.29,"modal_price_share":0.78,"price_cv":0.45174453755678545,"price_regimes":3,"sku":"21980","units":26958,"weeks_off_modal":22,"weeks_sold":100},{"description":"Pack Of 12 Hearts Design Tissues","distinct_prices":5,"modal_price_gbp":0.29,"modal_price_share":0.7549019607843137,"price_cv":0.4664621674033135,"price_regimes":4,"sku":"21985","units":25255,"weeks_off_modal":25,"weeks_sold":102},{"description":"Jumbo Bag Pink Vintage Paisley","distinct_prices":5,"modal_price_gbp":1.95,"modal_price_share":0.5979381443298969,"price_cv":0.2891667966419804,"price_regimes":3,"sku":"21929","units":25250,"weeks_off_modal":39,"weeks_sold":97},{"description":"Assorted Flower Colour \"Leis\"","distinct_prices":3,"modal_price_gbp":0.65,"modal_price_share":0.8977272727272727,"price_cv":1.0832656305425745,"price_regimes":3,"sku":"84212","units":24740,"weeks_off_modal":9,"weeks_sold":88},{"description":"Woodland Charlotte Bag","distinct_prices":4,"modal_price_gbp":0.85,"modal_price_share":0.8712871287128713,"price_cv":0.2824224987473315,"price_regimes":3,"sku":"20719","units":24043,"weeks_off_modal":13,"weeks_sold":101},{"description":"Jumbo Bag Scandinavian Paisley","distinct_prices":4,"modal_price_gbp":1.95,"modal_price_share":0.6,"price_cv":0.27278243721960105,"price_regimes":3,"sku":"21928","units":23979,"weeks_off_modal":40,"weeks_sold":100},{"description":"Pack Of 12 Woodland Tissues","distinct_prices":6,"modal_price_gbp":0.29,"modal_price_share":0.7142857142857143,"price_cv":0.5297389338178353,"price_regimes":3,"sku":"21981","units":21703,"weeks_off_modal":26,"weeks_sold":91},{"description":"Pack Of 12 Pink Paisley Tissues","distinct_prices":4,"modal_price_gbp":0.29,"modal_price_share":0.7373737373737373,"price_cv":0.5121733359974207,"price_regimes":4,"sku":"21984","units":21139,"weeks_off_modal":26,"weeks_sold":99},{"description":"Jumbo Bag Owls","distinct_prices":6,"modal_price_gbp":1.95,"modal_price_share":0.5955056179775281,"price_cv":0.3657348646174832,"price_regimes":3,"sku":"20713","units":20503,"weeks_off_modal":36,"weeks_sold":89},{"description":"Boys Alphabet Iron On Patches","distinct_prices":3,"modal_price_gbp":0.43,"modal_price_share":0.49411764705882355,"price_cv":0.21259914155391496,"price_regimes":3,"sku":"84598","units":20163,"weeks_off_modal":43,"weeks_sold":85},{"description":"Cook With Wine Metal Sign","distinct_prices":7,"modal_price_gbp":1.95,"modal_price_share":0.5106382978723404,"price_cv":0.3063471821877443,"price_regimes":4,"sku":"21166","units":19434,"weeks_off_modal":46,"weeks_sold":94},{"description":"Box Of 24 Cocktail Parasols","distinct_prices":5,"modal_price_gbp":0.42,"modal_price_share":0.8137254901960784,"price_cv":0.5321602630447079,"price_regimes":4,"sku":"84692","units":18608,"weeks_off_modal":19,"weeks_sold":102},{"description":"Jumbo Bag Woodland Animals","distinct_prices":5,"modal_price_gbp":1.95,"modal_price_share":0.5052631578947369,"price_cv":0.3828604889618978,"price_regimes":4,"sku":"20712","units":17506,"weeks_off_modal":47,"weeks_sold":95},{"description":"Single Heart Zinc T-Light Holder","distinct_prices":5,"modal_price_gbp":0.95,"modal_price_share":0.7722772277227723,"price_cv":0.3393874268517914,"price_regimes":3,"sku":"84970L","units":17210,"weeks_off_modal":23,"weeks_sold":101},{"description":"Aged Glass Silver T-Light Holder","distinct_prices":4,"modal_price_gbp":0.65,"modal_price_share":0.84,"price_cv":0.4310368610466555,"price_regimes":3,"sku":"21326","units":17202,"weeks_off_modal":16,"weeks_sold":100},{"description":"Black Record Cover Frame","distinct_prices":5,"modal_price_gbp":3.75,"modal_price_share":0.6907216494845361,"price_cv":0.2614795357667192,"price_regimes":3,"sku":"21137","units":17119,"weeks_off_modal":30,"weeks_sold":97},{"description":"Bag 250G Swirly Marbles","distinct_prices":5,"modal_price_gbp":0.85,"modal_price_share":0.8541666666666666,"price_cv":0.28853546724856305,"price_regimes":3,"sku":"21704","units":17007,"weeks_off_modal":14,"weeks_sold":96},{"description":"Jumbo Bag Spaceboy Design","distinct_prices":4,"modal_price_gbp":1.95,"modal_price_share":0.6041666666666666,"price_cv":0.2772614233050284,"price_regimes":3,"sku":"22385","units":16987,"weeks_off_modal":38,"weeks_sold":96},{"description":"Set/6 Fruit Salad Paper Cups","distinct_prices":5,"modal_price_gbp":0.65,"modal_price_share":0.3448275862068966,"price_cv":0.6398708917555849,"price_regimes":3,"sku":"21088","units":16590,"weeks_off_modal":38,"weeks_sold":58},{"description":"Set/6